{
  "$schema": "./capabilities-lock.v2.schema.json",
  "schemaVersion": 2,
  "status": "draft",
  "primitiveRepository": "agentic-delivery-lab/agentic-delivery-agent-customizations",
  "primitiveRelease": "urn:agentic-delivery:primitive-release:0.1.0-draft.15",
  "sourceCommit": "69beab027d8b28fc082fa6054f4def5ba0146e3c",
  "contentSha256": "4b6c07deb6f7be8f495244e3c50a528054528db1fdec5a5a14ea4cfdda5bb34e",
  "capabilityPolicyVersion": "0.1.0",
  "primitiveRepositoryId": 1380894656
}
